Paper,URL,Year,Writing Stage,Writing Context,Purpose,Specificity,Audience,Demographic Profile - Design,Demographic Profile - Evaluation,System Output Preferences - Design,System Output Preferences - Evaluation,Relationship to System - Design,Relationship to System - Evaluation,User Capabilities - Design,User Capabilities - Evaluation,Data - Source,Data - Size,Model - Type,Model - External Resource Access,Learning - Problem,Learning - Algorithm,Learning - Training and Adaptation,Evaluation - Evaluator,Evaluation - Focus,Scalability,User - Steering the System,User - Integrating System Output,UI - Interface Paradigm,UI - Layout,UI - Visual Differentiation,UI - Interaction Metaphor,UI - Initiation,System - Output Type,System - Curation Type,System - User Data Access,Digital Infrastructure,Social Factors,Locale,Access Model,Norms & Rules,Change Over Time
Recognizing Syntactic Errors in the Writing of Second Language Learners,https://aclanthology.org/P98-2196,1998,Revision,Professional,Educational,General Direction,Specified,Language & culture,Language & culture,Textual coherence,Textual coherence,"Ownership, Other","Ownership, Other",Writing expertise,Writing expertise,User,Medium (<10k),Rule-based model,"Tool, Data",Structured prediction,NA,Tuning decoding parameters,Automatic evaluation,Linguistic quality,Cost,Explicit,Selection,Text editor,Separated,Formatting,Tool,User-initiated,Analysis,Deterministic,Input text,NA,NA,NA,NA,NA,NA
The Role of Centering Theory's Rough-Shift in the Teaching and Evaluation of Writing Skills,https://aclanthology.org/P00-1052,2000,"Drafting, Revision",Academic,Educational,General Direction,Specified,Education,"Education, Profession",Textual coherence,Textual coherence,Ownership,Ownership,Writing expertise,Writing expertise,NA,NA,NA,NA,NA,NA,NA,NA,NA,NA,NA,NA,NA,Separated,NA,NA,NA,NA,NA,NA,NA,NA,NA,NA,NA,NA
PENS: A Machine-aided English Writing System for Chinese Users,https://aclanthology.org/P00-1067,2000,Drafting,NA,Translation,Nonspecific,Implied,Language & culture,Language & culture,Textual coherence,Textual coherence,Ownership,NA,Writing expertise,NA,Machine,Large (<1M),Statistical ML model,Data,Generation,Supervised learning,Fine-tuning,Automatic evaluation,Linguistic quality,Cost,Explicit,Selection,Text editor,Writing area,Formatting,Tool,User-initiated,"Proposal, Generation",Curated,Input text,NA,NA,NA,NA,NA,NA
A Writer's Collaborative Assistant,https://doi.org/10.1145/502716.502722,2002,Planning,Academic,Educational,Specific Objectives,Specified,Profession,"Profession, Education",NA,NA,Agency,Agency,Efficiency,Technical proficiency,Machine,NA,Rule-based model,Data,Structured prediction,Supervised learning,Other,Human evaluation,NA,Cost,No control,Inspiration,Text editor,Writing area,Location,Tool,System-initiated,Generation,Curated,Input text,"Usability consistency, Technical interoperability",Designing for social writing,Local writing,Free and open-source software,NA,Writing
Toward Evaluation of Writing Style: Overly Repetitious Word Use,https://aclanthology.org/E03-1003,2003,NA,NA,NA,NA,NA,Education,Profession,Textual diversity,Textual diversity,Ownership,Ownership,Writing expertise,Writing expertise,Expert,Medium (<10k),Deep neural network,NA,Classification,Supervised learning,Fine-tuning,Automatic evaluation,Linguistic quality,Cost,NA,NA,NA,NA,NA,NA,NA,NA,NA,NA,NA,NA,NA,NA,NA,NA
Automatic Analysis of Plot for Story Rewriting,https://aclanthology.org/W04-3217,2004,Revision,Creative,Educational,Specific Objectives,Specified,NA,NA,NA,NA,NA,NA,NA,NA,Expert,Medium (<10k),Statistical ML model,NA,Structured prediction,Supervised learning,Training from scratch,Automatic evaluation,Linguistic quality,Cost,NA,NA,NA,NA,NA,NA,NA,NA,NA,NA,NA,NA,NA,NA,NA,NA
Automated Japanese Essay Scoring System based on Articles Written by Experts,https://aclanthology.org/P06-1030,2006,NA,NA,NA,NA,NA,NA,NA,NA,NA,NA,NA,NA,NA,NA,NA,NA,NA,NA,NA,NA,NA,NA,NA,Explicit,No integration,Other,Separated,Location,Tool,User-initiated,Analysis,Deterministic,Input text,NA,NA,NA,NA,NA,NA
Is the Sky Pure Today? AwkChecker: An Assistive Tool for Detecting and Correcting Collocation Errors,https://doi.org/10.1145/1449715.1449736,2008,Revision,Academic,Educational,General Direction,Implied,Language & culture,Language & culture,"Textual coherence, Explainability",Explainability,"Transparency, Agency",Transparency,"Writing expertise, Cognition","Writing expertise, Confidence",Other,Unknown,Rule-based model,Data,"Classification, Generation",Unsupervised learning,NA,Human evaluation,Linguistic quality,NA,Explicit,"Inspiration, Selection",Text editor,Separated,Location,Tool,"User-initiated, System-initiated","Proposal, Generation",Model,Input text,Usability consistency,Designing with stakeholders,NA,Free and open-source software,Conventions,Writing
Common Sense Assistant for Writing Stories That Teach Social Skills,https://doi.org/10.1145/1358628.1358765,2008,Drafting,Creative,Accessibility,General Direction,Specified,NA,NA,"Textual coherence, Textual diversity","Textual coherence, Textual diversity",NA,NA,Empathy,Creativity,NA,Unknown,Rule-based model,NA,Generation,NA,NA,Human evaluation,Style & adequacy,NA,No control,Inspiration,Text editor,Separated,Location,"Tool, Hybrid","User-initiated, System-initiated",Proposal,Model,Input text,NA,Designing with stakeholders,NA,NA,Conventions,"Readers, Writing"
RiTa: Creativity Support for Computational Literature,https://doi.org/10.1145/1640233.1640265,2009,Drafting,Creative,Educational,Nonspecific,NA,"Profession, Education",Education,NA,NA,Transparency,NA,"Cognition, Creativity, Efficiency","Creativity, Confidence, Cognition",NA,NA,NA,NA,NA,NA,NA,NA,NA,NA,NA,NA,NA,NA,NA,NA,NA,NA,NA,NA,Technical interoperability,Designing with stakeholders,NA,Free and open-source software,NA,Writing
Motivating Expressive Writing with a Text-to-Sound Application,https://doi.org/10.1145/1753326.1753618,2010,Drafting,Personal,Narrative,General Direction,Specified,NA,NA,NA,NA,NA,NA,NA,NA,Expert,NA,Rule-based model,NA,Classification,NA,NA,Human evaluation,Style & adequacy,NA,No control,"Inspiration, No integration","Other, Text editor",Custom,NA,Tool,"User-initiated, System-initiated",Analysis,Model,Input text,NA,NA,NA,NA,NA,NA
Towards an Intelligent Reviewer's Assistant: Recommending Topics to Help Users to Write Better Product Reviews,https://doi.org/10.1145/2166966.2166995,2012,Drafting,Personal,Feedback,General Direction,Implied,NA,NA,Textual coherence,Textual coherence,NA,NA,NA,NA,User,Medium (<10k),Rule-based model,NA,Generation,NA,NA,"Automatic evaluation, Human-machine evaluation, Human evaluation","Style & adequacy, Linguistic quality",NA,No control,Inspiration,"Other, Text editor",Separated,Location,Tool,"User-initiated, Other",Proposal,Curated,Input text,Technical interoperability,Designing with stakeholders,NA,NA,Other,Writing
TransAhead: A Writing Assistant for CAT and CALL,https://aclanthology.org/E12-2004,2012,Drafting,Personal,Translation,Specific Objectives,Specified,NA,NA,NA,NA,NA,NA,NA,NA,Other,Unknown,Rule-based model,Data,Structured prediction,Supervised learning,NA,Automatic evaluation,Linguistic quality,Latency,Implicit,Inspiration,"Chatbot, Text editor","Writing area, Separated",Formatting,"Tool, Agent",System-initiated,Generation,"Customized, Model",Input text,NA,NA,NA,NA,NA,NA
TransAhead: A Computer-Assisted Translation and Writing Tool,https://aclanthology.org/N12-1036,2012,NA,NA,NA,NA,Specified,NA,NA,NA,NA,NA,NA,NA,NA,Other,Unknown,Rule-based model,Data,Structured prediction,Supervised learning,NA,Automatic evaluation,Linguistic quality,Latency,NA,NA,Text editor,NA,NA,NA,NA,NA,NA,NA,NA,NA,NA,NA,NA,NA
SWAN - Scientific Writing AssistaNt. A Tool for Helping Scholars to Write Reader-Friendly Manuscripts,https://aclanthology.org/E12-2005,2012,Revision,Academic,Expository,Detailed Requirements,Specified,Education,Education,Textual coherence,Textual coherence,Agency,Agency,Writing expertise,Writing expertise,NA,NA,NA,NA,NA,NA,NA,NA,NA,NA,"Implicit, Explicit","Inspiration, No integration",Other,Separated,Formatting,Tool,User-initiated,Analysis,"Curated, Model",Input text,NA,NA,NA,NA,NA,NA
"Detecting Boredom and Engagement during Writing with Keystroke Analysis, Task Appraisals, and Stable Traits",https://doi.org/10.1145/2449396.2449426,2013,NA,NA,NA,NA,NA,NA,NA,NA,NA,Agency,Agency,Emotion,Emotion,User,Medium (<10k),Statistical ML model,Data,Classification,Supervised learning,NA,Automatic evaluation,NA,Cost,NA,NA,NA,NA,NA,NA,NA,NA,NA,NA,NA,NA,NA,NA,NA,NA
WINGS:Writing with Intelligent Guidance and Suggestions,https://aclanthology.org/P14-5005,2014,NA,NA,NA,NA,NA,NA,Language & culture,Textual coherence,Textual coherence,NA,Trust,"Emotion, Efficiency",NA,Other,Large (<1M),"Statistical ML model, Rule-based model",Data,"Rewriting, Structured prediction, Generation",Unsupervised learning,NA,Automatic evaluation,Linguistic quality,Latency,"Implicit, Explicit",Selection,"Other, Text editor","Input UI, Separated",Location,Tool,System-initiated,"Proposal, Generation",Model,Input text,NA,NA,NA,NA,NA,NA
You're the Voice: Evaluating User Interfaces for Encouraging Underserved Youths to Express Themselves through Creative Writing,https://doi.org/10.1145/2757226.2757236,2015,NA,NA,NA,NA,NA,Socioeconomic status,"Socioeconomic status, Age","Textual diversity, Textual coherence","Textual diversity, Textual coherence",Agency,Agency,Creativity,Creativity,NA,NA,NA,NA,NA,NA,NA,NA,NA,NA,NA,NA,NA,NA,NA,NA,NA,NA,NA,NA,Usability consistency,Designing with stakeholders,Local writing,Free and open-source software,NA,Writing
Thesis Writer: A System for Supporting Academic Writing,https://doi.org/10.1145/2685553.2702687,2015,Planning,Academic,Expository,General Direction,Specified,"Education, Age, Profession","Age, Education",Textual coherence,NA,Ownership,Ownership,Writing expertise,NA,NA,NA,NA,NA,NA,NA,NA,NA,NA,NA,Implicit,Inspiration,Text editor,NA,NA,Tool,User-initiated,Generation,Model,Input text,NA,NA,NA,NA,NA,NA
Mining Memories: Designing a Platform to Support Social Media Based Writing,https://doi.org/10.1145/2702123.2702383,2015,Planning,Personal,Educational,General Direction,Specified,"Education, Age, Profession",Education,Textual coherence,Textual coherence,Agency,Agency,Writing expertise,Writing expertise,NA,NA,NA,NA,NA,NA,NA,NA,NA,NA,Implicit,Inspiration,Other,Custom,Media type,Tool,NA,Proposal,Customized,Other,"Usability consistency, Technical interoperability",Designing with stakeholders,Local writing,Free and open-source software,Conventions,Writing
Linguistic Template Extraction for Recognizing Reader-Emotion and Emotional Resonance Writing Assistance,https://aclanthology.org/P15-2127,2015,NA,NA,NA,NA,NA,NA,NA,NA,NA,NA,NA,NA,NA,"User, Other",Large (<1M),Statistical ML model,"Tool, Data",Classification,Supervised learning,NA,Automatic evaluation,Controllability,NA,NA,NA,NA,NA,NA,NA,NA,NA,NA,NA,NA,NA,NA,NA,NA,NA
InkWell: A Creative Writer's Creative Assistant,https://doi.org/10.1145/2757226.2757229,2015,Revision,Creative,"Descriptive, Entertainment",General Direction,NA,Profession,Profession,Personalization,"Personalization, Textual diversity",NA,NA,Creativity,Creativity,NA,Extremely large (>1M),Rule-based model,Data,Rewriting,NA,NA,Human evaluation,Controllability,Latency,Explicit,Inspiration,Other,Separated,Location,Hybrid,User-initiated,Proposal,Customized,Input text,NA,NA,NA,NA,NA,NA
WriteAhead2: Mining Lexical Grammar Patterns for Assisted Writing,https://aclanthology.org/N15-3022,2015,NA,NA,NA,NA,NA,Language & culture,NA,Textual coherence,Textual coherence,NA,NA,Writing expertise,Writing expertise,"Other, Expert","Unknown, Medium (<10k)",Rule-based model,Data,"Structured prediction, Retrieval",NA,NA,Human evaluation,Linguistic quality,NA,"No control, Explicit",Inspiration,Text editor,Separated,Location,Tool,System-initiated,Proposal,"Customized, Model",Input text,NA,NA,NA,NA,NA,NA
CroVeWA: Crosslingual Vector-Based Writing Assistance,https://aclanthology.org/N15-3019,2015,NA,NA,NA,NA,NA,Language & culture,NA,NA,NA,NA,NA,NA,NA,"Other, Expert","Unknown, Extremely large (>1M)",Deep neural network,Data,"Generation, Retrieval","Unsupervised learning, Supervised learning, Self-supervised learning",Training from scratch,NA,NA,NA,Explicit,No integration,Other,Separated,Location,Tool,User-initiated,Analysis,Model,Additional data,NA,NA,NA,NA,NA,NA
Using Context to Predict the Purpose of Argumentative Writing Revisions,https://aclanthology.org/N16-1168,2016,NA,NA,NA,NA,NA,NA,NA,NA,NA,NA,NA,NA,NA,Authors,"Small (<100), Medium (<10k)",Statistical ML model,Tool,Classification,Supervised learning,Training from scratch,Automatic evaluation,Linguistic quality,NA,NA,NA,NA,NA,NA,NA,NA,NA,NA,NA,NA,NA,NA,NA,NA,NA
Non-uniform Language Detection in Technical Writing,https://aclanthology.org/D16-1194,2016,NA,NA,NA,NA,NA,NA,NA,NA,NA,NA,NA,NA,NA,Other,Medium (<10k),Statistical ML model,"Tool, Data",Classification,Supervised learning,Training from scratch,Automatic evaluation,Other,NA,NA,NA,NA,NA,NA,NA,NA,NA,NA,NA,NA,NA,NA,NA,NA,NA
Compositional Sequence Labeling Models for Error Detection in Learner Writing,https://aclanthology.org/P16-1112,2016,NA,NA,NA,NA,NA,Language & culture,NA,NA,NA,NA,NA,Writing expertise,NA,User,Large (<1M),Deep neural network,NA,Classification,Supervised learning,Training from scratch,Automatic evaluation,Other,NA,NA,NA,NA,NA,NA,NA,NA,NA,NA,NA,NA,NA,NA,NA,NA,NA
Adapting Grammatical Error Correction Based on the Native Language of Writers with Neural Network Joint Models,https://aclanthology.org/D16-1195,2016,NA,NA,NA,NA,NA,Language & culture,Language & culture,Textual coherence,Textual coherence,NA,NA,Writing expertise,NA,User,Extremely large (>1M),Deep neural network,Tool,"Classification, Rewriting",Supervised learning,Fine-tuning,Automatic evaluation,Linguistic quality,Latency,NA,NA,NA,NA,NA,NA,NA,NA,NA,NA,NA,NA,NA,NA,NA,NA
ArgRewrite: A Web-based Revision Assistant for Argumentative Writings,https://aclanthology.org/N16-3008,2016,Revision,Academic,Persuasive,Specific Objectives,NA,"Education, Profession",NA,Explainability,NA,NA,NA,Writing expertise,NA,NA,NA,Statistical ML model,NA,Classification,NA,NA,NA,NA,NA,Explicit,No integration,Other,Separated,Formatting,Tool,User-initiated,Analysis,Deterministic,Input text,NA,NA,NA,NA,NA,NA
The arText prototype: An automatic system for writing specialized texts,https://aclanthology.org/E17-3015,2017,Revision,Professional,Expository,Specific Objectives,NA,Profession,Profession,Textual coherence,Textual coherence,NA,NA,Writing expertise,NA,NA,NA,Rule-based model,NA,Classification,NA,NA,NA,Style & adequacy,NA,Explicit,No integration,Text editor,Separated,NA,Tool,User-initiated,Analysis,Deterministic,Input text,Usability consistency,Designing with stakeholders,Local writing,Free and open-source software,Conventions,Writing
LyriSys: An Interactive Support System for Writing Lyrics Based on Topic Transition,https://doi.org/10.1145/3025171.3025194,2017,Drafting,Creative,Entertainment,"Detailed Requirements, General Direction",NA,Profession,Profession,NA,NA,NA,NA,Creativity,Creativity,"Other, Expert",Large (<1M),Statistical ML model,NA,Generation,Unsupervised learning,NA,NA,Style & adequacy,NA,Explicit,Editing,"Other, Text editor","Writing area, Custom","None, Location",Tool,User-initiated,Generation,Model,Input text,NA,NA,NA,NA,NA,NA
Paper Abstract Writing through Editing Mechanism,https://aclanthology.org/P18-2042,2018,NA,NA,NA,NA,NA,NA,NA,NA,NA,NA,NA,NA,NA,Expert,Medium (<10k),Deep neural network,NA,Generation,Supervised learning,Training from scratch,"Automatic evaluation, Human evaluation",Style & adequacy,NA,NA,NA,NA,NA,NA,NA,NA,NA,NA,NA,Usability consistency,"Other, Designing for social writing",Local writing,Free and open-source software,Conventions,Other
"Multitasking with Play Write, a Mobile Microproductivity Writing Tool",https://doi.org/10.1145/3242587.3242611,2018,Revision,"Professional, Academic, Journalistic, Technical, Creative",NA,Nonspecific,NA,NA,NA,NA,NA,NA,NA,Efficiency,Efficiency,NA,NA,NA,NA,NA,NA,NA,NA,NA,NA,Explicit,Selection,Other,"Custom, Separated",NA,Tool,NA,Proposal,Deterministic,"Additional data, Input text",Technical interoperability,Designing with stakeholders,Remote writing,Free and open-source software,NA,NA
MirrorU: Scaffolding Emotional Reflection via In-Situ Assessment and Interactive Feedback,https://doi.org/10.1145/3170427.3188517,2018,Drafting,Personal,Descriptive,Detailed Requirements,Implied,NA,NA,Personalization,Personalization,Ownership,Ownership,Emotion,Emotion,"User, Expert",Medium (<10k),Statistical ML model,NA,Classification,Supervised learning,NA,Automatic evaluation,NA,NA,No control,"Inspiration, No integration","Other, Text editor",Separated,Media type,Tool,System-initiated,Analysis,Customized,Input text,Technical interoperability,Designing with stakeholders,Remote writing,Free and open-source software,NA,Writing
Itero: A Revision History Analytics Tool for Exploring Writing Behavior and Reflection,https://doi.org/10.1145/3170427.3188474,2018,Revision,Academic,NA,Detailed Requirements,NA,Education,Education,NA,NA,NA,NA,Efficiency,Efficiency,NA,NA,NA,NA,NA,NA,NA,NA,NA,NA,"No control, Implicit",No integration,Other,Custom,Media type,Tool,User-initiated,Analysis,"Deterministic, Customized",Input text,Technical interoperability,"Designing with stakeholders, Designing for social writing",NA,NA,NA,Authors
IntroAssist: A Tool to Support Writing Introductory Help Requests,https://doi.org/10.1145/3173574.3173596,2018,Drafting,Professional,Persuasive,Specific Objectives,Implied,"Profession, Socioeconomic status",NA,NA,NA,NA,NA,"Writing expertise, Confidence",Confidence,NA,NA,NA,NA,NA,NA,NA,NA,NA,NA,No control,No integration,Text editor,Separated,Location,Tool,User-initiated,Proposal,"Curated, Deterministic",Input text,NA,Designing with stakeholders,Local writing,NA,Conventions,Writing
Feedback Orchestration: Structuring Feedback for Facilitating Reflection and Revision in Writing,https://doi.org/10.1145/3272973.3274069,2018,Revision,"Academic, Creative","Educational, Analytical","Detailed Requirements, General Direction",Specified,"Language & culture, Education",Language & culture,Explainability,NA,NA,NA,Writing expertise,Writing expertise,Other,NA,Rule-based model,NA,Classification,NA,NA,Human evaluation,Other,NA,"No control, Explicit",No integration,"Other, Text editor",Separated,"None, Location",Tool,User-initiated,Analysis,"Deterministic, Customized",Input text,NA,Designing with stakeholders,NA,NA,Conventions,Authors
Demonstrating Par4Sem - A Semantic Writing Aid with Adaptive Paraphrasing,https://aclanthology.org/D18-2009,2018,Revision,Other,Accessibility,General Direction,Specified,NA,NA,NA,NA,NA,NA,NA,NA,Other,Large (<1M),"Statistical ML model, Deep neural network",Tool,"Classification, Regression, Retrieval","Supervised learning, Reinforcement learning",Fine-tuning,Human-machine evaluation,Other,NA,"No control, Explicit",Selection,Text editor,Writing area,Formatting,Tool,User-initiated,"Proposal, Generation",Model,Input text,NA,Designing with stakeholders,NA,Free and open-source software,Other,NA
Creative Writing with a Machine in the Loop: Case Studies on Slogans and Stories,https://doi.org/10.1145/3172944.3172983,2018,Drafting,Creative,"Narrative, Persuasive",General Direction,Implied,NA,Profession,"Textual coherence, Textual diversity","Textual coherence, Textual diversity",NA,Agency,"Creativity, Cognition","Creativity, Writing expertise",Other,Medium (<10k),Deep neural network,NA,Generation,"Unsupervised learning, Supervised learning",Fine-tuning,Human evaluation,"Style & adequacy, Linguistic quality",NA,"Implicit, Explicit",Selection,Text editor,Separated,Location,"Tool, Agent",User-initiated,"Proposal, Generation",Model,Input text,NA,Designing with stakeholders,NA,Free and open-source software,NA,"Authors, Writing"
Content Explorer: Recommending Novel Entities for a Document Writer,https://aclanthology.org/D18-1374,2018,NA,NA,NA,NA,NA,NA,NA,Textual coherence,Textual coherence,NA,NA,NA,NA,Other,Extremely large (>1M),Statistical ML model,NA,Classification,Supervised learning,NA,Human evaluation,Style & adequacy,NA,NA,NA,NA,NA,NA,NA,NA,NA,NA,NA,NA,NA,NA,NA,NA,NA
Automated Assistance for Creative Writing with an RNN Language Model,https://doi.org/10.1145/3180308.3180329,2018,Drafting,Creative,Narrative,"Nonspecific, General Direction","Implied, Other",NA,NA,"Textual diversity, Textual coherence",Textual coherence,Trust,Trust,Creativity,Creativity,"Other, Expert",Medium (<10k),Deep neural network,NA,Generation,"Unsupervised learning, Self-supervised learning",Training from scratch,"Human-machine evaluation, Human evaluation",Linguistic quality,NA,"Implicit, Explicit","Editing, Inspiration",Text editor,Writing area,Formatting,Tool,User-initiated,Generation,Model,Input text,Usability consistency,"Other, Designing with stakeholders, Designing for social writing",Local writing,Free and open-source software,NA,Authors
A Corpus of Non-Native Written English Annotated for Metaphor,https://aclanthology.org/N18-2014,2018,NA,NA,NA,NA,NA,NA,NA,NA,NA,NA,NA,NA,NA,User,Medium (<10k),NA,NA,NA,NA,NA,NA,NA,NA,NA,NA,NA,NA,NA,NA,NA,NA,NA,NA,Technical interoperability,Designing with stakeholders,Local writing,Free and open-source software,Conventions,Writing
Toward a Task of Feedback Comment Generation for Writing Learning,https://aclanthology.org/D19-1316,2019,Revision,Academic,Educational,Specific Objectives,Specified,Education,NA,Explainability,Explainability,NA,NA,NA,NA,"User, Other",Medium (<10k),Deep neural network,Tool,Classification,Supervised learning,Training from scratch,Automatic evaluation,Style & adequacy,NA,NA,NA,NA,NA,NA,NA,NA,NA,NA,NA,Usability consistency,NA,Local writing,Free and open-source software,NA,Technologies
"Plan, Write, and Revise: an Interactive System for Open-Domain Story Generation",https://aclanthology.org/N19-4016,2019,"Planning, Drafting, Revision",Creative,Entertainment,Nonspecific,Implied,NA,NA,Textual coherence,Textual diversity,Agency,Trust,Creativity,Creativity,NA,NA,Deep neural network,Data,Generation,NA,Tuning decoding parameters,Human evaluation,Controllability,NA,Explicit,Selection,Other,Separated,Location,Tool,User-initiated,Generation,Model,Input text,Usability consistency,"Designing with stakeholders, Designing for social writing",Local writing,Free and open-source software,Conventions,Writing
On How Users Edit Computer-Generated Visual Stories,https://doi.org/10.1145/3290607.3312965,2019,Revision,Creative,"Narrative, Expository, Entertainment",NA,Specified,NA,NA,NA,NA,NA,NA,NA,NA,NA,NA,NA,NA,NA,NA,NA,NA,NA,NA,NA,NA,NA,NA,NA,NA,NA,NA,NA,NA,Technical interoperability,Designing with stakeholders,Local writing,NA,Conventions,"Technologies, Writing"
Neural-based Chinese Idiom Recommendation for Enhancing Elegance in Essay Writing,https://aclanthology.org/P19-1552,2019,Revision,NA,Descriptive,Specific Objectives,Implied,NA,NA,NA,NA,NA,NA,NA,NA,Other,Medium (<10k),Statistical ML model,NA,Structured prediction,Unsupervised learning,Training from scratch,Automatic evaluation,Linguistic quality,NA,NA,NA,NA,NA,NA,NA,NA,NA,NA,NA,NA,NA,NA,NA,NA,NA
Metaphoria: An Algorithmic Companion for Metaphor Creation,https://doi.org/10.1145/3290605.3300526,2019,Idea generation,Creative,"Narrative, Descriptive","Detailed Requirements, Specific Objectives",Specified,Profession,Profession,"Textual coherence, Textual diversity","Textual diversity, Textual coherence",Agency,"Agency, Ownership",Creativity,Creativity,User,NA,"Deep neural network, Rule-based model",Tool,"Generation, Structured prediction",Unsupervised learning,NA,Human evaluation,"Style & adequacy, Linguistic quality",NA,No control,Inspiration,Other,Separated,Location,Tool,User-initiated,Generation,Model,Input text,Usability consistency,"Designing with stakeholders, Designing for social writing",Local writing,Free and open-source software,Other,Writing
Learning Emphasis Selection for Written Text in Visual Media from Crowd-Sourced Label Distributions,https://aclanthology.org/P19-1112,2019,NA,NA,NA,NA,NA,NA,NA,NA,NA,NA,NA,NA,NA,"Other, Expert",Medium (<10k),Deep neural network,Data,Generation,Unsupervised learning,Training from scratch,Human evaluation,Other,NA,NA,NA,NA,NA,NA,NA,NA,NA,NA,NA,NA,NA,NA,NA,NA,NA
iComposer: An Automatic Songwriting System for Chinese Popular Music,https://aclanthology.org/N19-4015,2019,Drafting,Creative,Entertainment,Nonspecific,Specified,NA,NA,NA,NA,NA,NA,NA,NA,Other,Medium (<10k),Deep neural network,NA,Structured prediction,Unsupervised learning,NA,"Human-machine evaluation, Human evaluation",Style & adequacy,NA,NA,NA,NA,NA,NA,NA,NA,NA,NA,NA,NA,NA,NA,NA,NA,NA
"How a Stylistic, Machine-Generated Thesaurus Impacts a Writer's Process",https://doi.org/10.1145/3325480.3326573,2019,Drafting,Creative,Descriptive,General Direction,Implied,NA,Education,Textual diversity,Textual coherence,NA,NA,Writing expertise,Writing expertise,Other,Large (<1M),Statistical ML model,NA,Structured prediction,Supervised learning,Training from scratch,Human evaluation,Linguistic quality,NA,NA,NA,NA,NA,NA,NA,NA,NA,NA,NA,NA,Designing with stakeholders,NA,Free and open-source software,NA,Writing
Empowering Expression for Users with Aphasia through Constrained Creativity,https://doi.org/10.1145/3290605.3300615,2019,Drafting,Creative,Accessibility,"General Direction, Specific Objectives","Implied, Specified",NA,NA,Textual diversity,Textual diversity,Ownership,Ownership,Creativity,"Creativity, Efficiency, Neurodiversity",NA,NA,Rule-based model,NA,NA,NA,NA,Automatic evaluation,NA,NA,NA,NA,NA,NA,NA,NA,NA,NA,NA,NA,NA,Designing with stakeholders,NA,Free and open-source software,Conventions,Writing
